MCQ,Choices,Correct
What is the scientific study of life called?,a: Chemistry | b: Biology | c: Physics | d: Geology,b
Which theme in biology explains the unity and diversity of life?,a: Evolution | b: Photosynthesis | c: Cellular respiration | d: Mitosis,a
"What allows organisms to move, grow, and reproduce?",a: Energy processing | b: Genetic mutation | c: Cell division | d: Photosynthesis,a
What is the basic unit of life that processes hereditary information?,a: Tissue | b: Organ | c: Cell | d: Organism,c
When did life on Earth emerge?,"a: 1 million years ago | b: 3.7 billion years ago | c: 10,000 years ago | d: 500 million years ago",b
